{
  "schemaVersion": "1.0",
  "id": "discord",
  "name": "Discord",
  "descriptionKey": "packages.discord.description",
  "category": "communication",
  "subcategory": "chat",
  "publisher": "Discord Inc.",
  "officialWebsite": "https://discord.com/download",
  "source": {
    "type": "winget",
    "packageId": "Discord.Discord",
    "sourceName": "winget"
  },
  "compatibility": {
    "os": [
      "windows10",
      "windows11"
    ],
    "minimumBuild": 17763,
    "architectures": [
      "x64"
    ],
    "minimumRamGB": 2,
    "hardware": {},
    "features": {
      "internet": true
    }
  },
  "versionPolicy": {
    "strategy": "latest-compatible",
    "channel": "stable"
  },
  "detection": {
    "wingetIds": [
      "Discord.Discord"
    ],
    "registryDisplayNames": [
      "Discord"
    ],
    "knownPaths": [
      "%LocalAppData%\\Discord\\Update.exe"
    ]
  },
  "dependencies": [],
  "install": {
    "mode": "silent",
    "requiresAdmin": false,
    "silent": true,
    "scope": "either"
  },
  "verification": {
    "methods": [
      "winget",
      "registry",
      "path"
    ],
    "minimumMatches": 1,
    "notes": ""
  },
  "restart": {
    "required": false,
    "behavior": "none"
  },
  "riskLevel": "SAFE",
  "license": {
    "type": "freemium",
    "cost": "mixed",
    "notes": ""
  },
  "recommendation": {
    "profiles": [
      "gaming",
      "full-recommended"
    ],
    "default": false,
    "conditions": []
  },
  "tags": [
    "communication",
    "chat"
  ]
}

