{
  "schemaVersion": "1.0",
  "id": "handbrake",
  "name": "HandBrake",
  "descriptionKey": "packages.handbrake.description",
  "category": "creator",
  "subcategory": "video",
  "publisher": "The HandBrake Team",
  "officialWebsite": "https://handbrake.fr/downloads.php",
  "source": {
    "type": "winget",
    "packageId": "HandBrake.HandBrake",
    "sourceName": "winget"
  },
  "compatibility": {
    "os": [
      "windows10",
      "windows11"
    ],
    "minimumBuild": 17763,
    "architectures": [
      "x64",
      "arm64"
    ],
    "minimumRamGB": 2,
    "hardware": {},
    "features": {
      "internet": true
    }
  },
  "versionPolicy": {
    "strategy": "latest-compatible",
    "channel": "stable"
  },
  "detection": {
    "wingetIds": [
      "HandBrake.HandBrake"
    ],
    "registryDisplayNames": [
      "HandBrake"
    ],
    "knownPaths": [
      "%ProgramFiles%\\HandBrake\\HandBrake.exe"
    ]
  },
  "dependencies": [
    "dotnet-desktop-runtime"
  ],
  "install": {
    "mode": "silent",
    "requiresAdmin": true,
    "silent": true,
    "scope": "machine"
  },
  "verification": {
    "methods": [
      "winget",
      "registry",
      "path"
    ],
    "minimumMatches": 1,
    "notes": ""
  },
  "restart": {
    "required": false,
    "behavior": "none"
  },
  "riskLevel": "SAFE",
  "license": {
    "type": "open-source",
    "cost": "free",
    "notes": ""
  },
  "recommendation": {
    "profiles": [],
    "default": false,
    "conditions": []
  },
  "tags": [
    "creator",
    "video"
  ]
}
