{
  "schemaVersion": "1.0",
  "id": "git-lfs",
  "name": "Git LFS",
  "descriptionKey": "packages.git-lfs.description",
  "category": "developer",
  "subcategory": "version-control",
  "publisher": "GitHub, Inc.",
  "officialWebsite": "https://git-lfs.com/",
  "source": {
    "type": "winget",
    "packageId": "GitHub.GitLFS",
    "sourceName": "winget"
  },
  "compatibility": {
    "os": [
      "windows10",
      "windows11"
    ],
    "minimumBuild": 17763,
    "architectures": [
      "x64",
      "arm64"
    ],
    "minimumRamGB": 2,
    "hardware": {},
    "features": {
      "internet": true
    }
  },
  "versionPolicy": {
    "strategy": "latest-compatible",
    "channel": "stable"
  },
  "detection": {
    "wingetIds": [
      "GitHub.GitLFS"
    ],
    "registryDisplayNames": [
      "Git LFS"
    ],
    "knownPaths": [
      "%ProgramFiles%\\Git LFS\\git-lfs.exe"
    ]
  },
  "dependencies": [
    "git"
  ],
  "install": {
    "mode": "silent",
    "requiresAdmin": true,
    "silent": true,
    "scope": "machine"
  },
  "verification": {
    "methods": [
      "winget",
      "registry",
      "path"
    ],
    "minimumMatches": 1,
    "notes": ""
  },
  "restart": {
    "required": false,
    "behavior": "none"
  },
  "riskLevel": "SAFE",
  "license": {
    "type": "open-source",
    "cost": "free",
    "notes": ""
  },
  "recommendation": {
    "profiles": [
      "full-stack"
    ],
    "default": false,
    "conditions": []
  },
  "tags": [
    "developer",
    "version-control"
  ]
}

