{
  "schemaVersion": "1.0",
  "id": "firefox",
  "name": "Mozilla Firefox",
  "descriptionKey": "packages.firefox.description",
  "category": "essential",
  "subcategory": "browser",
  "publisher": "Mozilla Foundation",
  "officialWebsite": "https://www.mozilla.org/firefox/new/",
  "source": {
    "type": "winget",
    "packageId": "Mozilla.Firefox",
    "sourceName": "winget"
  },
  "compatibility": {
    "os": [
      "windows10",
      "windows11"
    ],
    "minimumBuild": 17763,
    "architectures": [
      "x64",
      "arm64"
    ],
    "minimumRamGB": 2,
    "hardware": {},
    "features": {
      "internet": true
    }
  },
  "versionPolicy": {
    "strategy": "latest-compatible",
    "channel": "stable"
  },
  "detection": {
    "wingetIds": [
      "Mozilla.Firefox"
    ],
    "registryDisplayNames": [
      "Mozilla Firefox"
    ],
    "knownPaths": [
      "%ProgramFiles%\\Mozilla Firefox\\firefox.exe"
    ]
  },
  "dependencies": [],
  "install": {
    "mode": "silent",
    "requiresAdmin": false,
    "silent": true,
    "scope": "either"
  },
  "verification": {
    "methods": [
      "winget",
      "registry",
      "path"
    ],
    "minimumMatches": 1,
    "notes": ""
  },
  "restart": {
    "required": false,
    "behavior": "none"
  },
  "riskLevel": "SAFE",
  "license": {
    "type": "open-source",
    "cost": "free",
    "notes": ""
  },
  "recommendation": {
    "profiles": [],
    "default": false,
    "conditions": []
  },
  "tags": [
    "essential",
    "browser"
  ]
}

