{
  "schemaVersion": "1.0",
  "id": "ea-app",
  "name": "EA app",
  "descriptionKey": "packages.ea-app.description",
  "category": "gaming",
  "subcategory": "launcher",
  "publisher": "Electronic Arts Inc.",
  "officialWebsite": "https://www.ea.com/ea-app",
  "source": {
    "type": "winget",
    "packageId": "ElectronicArts.EADesktop",
    "sourceName": "winget"
  },
  "compatibility": {
    "os": [
      "windows10",
      "windows11"
    ],
    "minimumBuild": 17763,
    "architectures": [
      "x64"
    ],
    "minimumRamGB": 2,
    "hardware": {},
    "features": {
      "internet": true
    }
  },
  "versionPolicy": {
    "strategy": "latest-compatible",
    "channel": "stable"
  },
  "detection": {
    "wingetIds": [
      "ElectronicArts.EADesktop"
    ],
    "registryDisplayNames": [
      "EA app"
    ],
    "knownPaths": [
      "%ProgramFiles%\\Electronic Arts\\EA Desktop\\EA Desktop\\EADesktop.exe"
    ]
  },
  "dependencies": [],
  "install": {
    "mode": "silent",
    "requiresAdmin": true,
    "silent": true,
    "scope": "machine"
  },
  "verification": {
    "methods": [
      "winget",
      "registry",
      "path"
    ],
    "minimumMatches": 1,
    "notes": ""
  },
  "restart": {
    "required": false,
    "behavior": "none"
  },
  "riskLevel": "SAFE",
  "license": {
    "type": "freeware",
    "cost": "free",
    "notes": ""
  },
  "recommendation": {
    "profiles": [],
    "default": false,
    "conditions": []
  },
  "tags": [
    "gaming",
    "launcher"
  ]
}

