{
  "schemaVersion": "1.0",
  "id": "spotify",
  "name": "Spotify",
  "descriptionKey": "packages.spotify.description",
  "category": "essential",
  "subcategory": "media",
  "publisher": "Spotify AB",
  "officialWebsite": "https://www.spotify.com/download/windows/",
  "source": {
    "type": "winget",
    "packageId": "Spotify.Spotify",
    "sourceName": "winget"
  },
  "compatibility": {
    "os": [
      "windows10",
      "windows11"
    ],
    "minimumBuild": 17763,
    "architectures": [
      "x64",
      "arm64"
    ],
    "minimumRamGB": 2,
    "hardware": {},
    "features": {
      "internet": true
    }
  },
  "versionPolicy": {
    "strategy": "latest-compatible",
    "channel": "stable"
  },
  "detection": {
    "wingetIds": [
      "Spotify.Spotify"
    ],
    "registryDisplayNames": [
      "Spotify"
    ],
    "knownPaths": [
      "%AppData%\\Spotify\\Spotify.exe"
    ]
  },
  "dependencies": [],
  "install": {
    "mode": "silent",
    "requiresAdmin": false,
    "silent": true,
    "scope": "either"
  },
  "verification": {
    "methods": [
      "winget",
      "registry",
      "path"
    ],
    "minimumMatches": 1,
    "notes": ""
  },
  "restart": {
    "required": false,
    "behavior": "none"
  },
  "riskLevel": "SAFE",
  "license": {
    "type": "freemium",
    "cost": "mixed",
    "notes": ""
  },
  "recommendation": {
    "profiles": [],
    "default": false,
    "conditions": []
  },
  "tags": [
    "essential",
    "media"
  ]
}
