{
  "schemaVersion": "1.0",
  "id": "php",
  "name": "PHP 8.4",
  "descriptionKey": "packages.php.description",
  "category": "developer",
  "subcategory": "runtime",
  "publisher": "The PHP Group",
  "officialWebsite": "https://windows.php.net/download/",
  "source": {
    "type": "winget",
    "packageId": "PHP.PHP.8.4",
    "sourceName": "winget"
  },
  "compatibility": {
    "os": [
      "windows10",
      "windows11"
    ],
    "minimumBuild": 17763,
    "architectures": [
      "x64"
    ],
    "minimumRamGB": 2,
    "hardware": {},
    "features": {
      "internet": true
    }
  },
  "versionPolicy": {
    "strategy": "latest-compatible",
    "channel": "stable"
  },
  "detection": {
    "wingetIds": [
      "PHP.PHP.8.4"
    ],
    "registryDisplayNames": [
      "PHP 8.4"
    ],
    "knownPaths": []
  },
  "dependencies": [
    "vcpp-x64"
  ],
  "install": {
    "mode": "silent",
    "requiresAdmin": true,
    "silent": true,
    "scope": "machine"
  },
  "verification": {
    "methods": [
      "winget",
      "registry"
    ],
    "minimumMatches": 1,
    "notes": "A generic php.exe path does not prove that the installed major/minor channel is PHP 8.4."
  },
  "restart": {
    "required": false,
    "behavior": "none"
  },
  "riskLevel": "SAFE",
  "license": {
    "type": "open-source",
    "cost": "free",
    "notes": ""
  },
  "recommendation": {
    "profiles": [],
    "default": false,
    "conditions": []
  },
  "tags": [
    "developer",
    "runtime"
  ]
}
