{
  "schemaVersion": "1.0",
  "id": "mongodb-compass",
  "name": "MongoDB Compass",
  "descriptionKey": "packages.mongodb-compass.description",
  "category": "developer",
  "subcategory": "database",
  "publisher": "MongoDB, Inc.",
  "officialWebsite": "https://www.mongodb.com/products/tools/compass",
  "source": {
    "type": "winget",
    "packageId": "MongoDB.Compass.Full",
    "sourceName": "winget"
  },
  "compatibility": {
    "os": [
      "windows10",
      "windows11"
    ],
    "minimumBuild": 17763,
    "architectures": [
      "x64"
    ],
    "minimumRamGB": 4,
    "hardware": {},
    "features": {
      "internet": true
    }
  },
  "versionPolicy": {
    "strategy": "latest-compatible",
    "channel": "stable"
  },
  "detection": {
    "wingetIds": [
      "MongoDB.Compass.Full"
    ],
    "registryDisplayNames": [
      "MongoDB Compass"
    ],
    "knownPaths": [
      "%LocalAppData%\\MongoDBCompass\\MongoDBCompass.exe"
    ]
  },
  "dependencies": [],
  "install": {
    "mode": "silent",
    "requiresAdmin": false,
    "silent": true,
    "scope": "either"
  },
  "verification": {
    "methods": [
      "winget",
      "registry",
      "path"
    ],
    "minimumMatches": 1,
    "notes": ""
  },
  "restart": {
    "required": false,
    "behavior": "none"
  },
  "riskLevel": "SAFE",
  "license": {
    "type": "freeware",
    "cost": "free",
    "notes": ""
  },
  "recommendation": {
    "profiles": [],
    "default": false,
    "conditions": []
  },
  "tags": [
    "developer",
    "database"
  ]
}

